{
  "$schema": "https://json-schema.org/draft/2020-12/schema",
  "$id": "https://jocky.dev/schemas/v1/evidence-manifest.schema.json",
  "title": "EvidenceManifest",
  "description": "Integrity manifest for evidence produced by one endpoint task.",
  "type": "object",
  "additionalProperties": false,
  "required": [
    "schema_version",
    "manifest_id",
    "case_id",
    "task_id",
    "endpoint_id",
    "created_at",
    "entries"
  ],
  "properties": {
    "schema_version": {
      "const": "1.0.0"
    },
    "manifest_id": {
      "type": "string",
      "format": "uuid",
      "pattern": "^[0-9a-fA-F]{8}-[0-9a-fA-F]{4}-[0-9a-fA-F]{4}-[0-9a-fA-F]{4}-[0-9a-fA-F]{12}$"
    },
    "case_id": {
      "type": "string",
      "format": "uuid",
      "pattern": "^[0-9a-fA-F]{8}-[0-9a-fA-F]{4}-[0-9a-fA-F]{4}-[0-9a-fA-F]{4}-[0-9a-fA-F]{12}$"
    },
    "task_id": {
      "type": "string",
      "format": "uuid",
      "pattern": "^[0-9a-fA-F]{8}-[0-9a-fA-F]{4}-[0-9a-fA-F]{4}-[0-9a-fA-F]{4}-[0-9a-fA-F]{12}$"
    },
    "endpoint_id": {
      "type": "string",
      "format": "uuid",
      "pattern": "^[0-9a-fA-F]{8}-[0-9a-fA-F]{4}-[0-9a-fA-F]{4}-[0-9a-fA-F]{4}-[0-9a-fA-F]{12}$"
    },
    "created_at": {
      "type": "string",
      "format": "date-time",
      "pattern": "^\\d{4}-\\d{2}-\\d{2}T\\d{2}:\\d{2}:\\d{2}(?:\\.\\d+)?Z$"
    },
    "entries": {
      "type": "array",
      "minItems": 1,
      "items": {
        "type": "object",
        "additionalProperties": false,
        "required": [
          "evidence_id",
          "record_id",
          "relative_path",
          "media_type",
          "byte_length",
          "sha256",
          "collected_at"
        ],
        "properties": {
          "evidence_id": {
            "type": "string",
            "format": "uuid",
            "pattern": "^[0-9a-fA-F]{8}-[0-9a-fA-F]{4}-[0-9a-fA-F]{4}-[0-9a-fA-F]{4}-[0-9a-fA-F]{12}$"
          },
          "record_id": {
            "type": "string",
            "format": "uuid",
            "pattern": "^[0-9a-fA-F]{8}-[0-9a-fA-F]{4}-[0-9a-fA-F]{4}-[0-9a-fA-F]{4}-[0-9a-fA-F]{12}$"
          },
          "relative_path": {
            "type": "string",
            "minLength": 1,
            "maxLength": 1024,
            "pattern": "^[A-Za-z0-9][A-Za-z0-9._/-]*$",
            "not": {
              "pattern": "(^|/)\\.\\.(/|$)"
            }
          },
          "media_type": {
            "type": "string",
            "pattern": "^[A-Za-z0-9!#$&^_.+-]+/[A-Za-z0-9!#$&^_.+-]+$",
            "maxLength": 255
          },
          "byte_length": {
            "type": "integer",
            "minimum": 0
          },
          "sha256": {
            "type": "string",
            "pattern": "^[a-f0-9]{64}$"
          },
          "collected_at": {
            "type": "string",
            "format": "date-time",
            "pattern": "^\\d{4}-\\d{2}-\\d{2}T\\d{2}:\\d{2}:\\d{2}(?:\\.\\d+)?Z$"
          }
        }
      }
    }
  }
}

