{
  "schema_version": "1.0.0",
  "manifest_id": "55555555-5555-4555-8555-555555555555",
  "case_id": "aaaaaaaa-aaaa-4aaa-8aaa-aaaaaaaaaaaa",
  "task_id": "22222222-2222-4222-8222-222222222222",
  "endpoint_id": "11111111-1111-4111-8111-111111111111",
  "created_at": "2026-08-30T12:03:00Z",
  "entries": [
    {
      "evidence_id": "88888888-8888-4888-8888-888888888888",
      "record_id": "44444444-4444-4444-8444-444444444444",
      "relative_path": "records/system-profile.json",
      "media_type": "application/json",
      "byte_length": 128,
      "sha256": "bbbbbbbbbbbbbbbbbbbbbbbbbbbbbbbbbbbbbbbbbbbbbbbbbbbbbbbbbbbbbbbb",
      "collected_at": "2026-08-30T12:02:00Z"
    }
  ]
}

